{
  "$schema": "http://json-schema.org/draft-07/schema#",
  "title": "Pet",
  "description": "Pet object schema for Petstore API",
  "type": "object",
  "required": ["name", "photoUrls"],
  "properties": {
    "id": {
      "type": "integer",
      "format": "int64",
      "description": "Unique identifier for the pet"
    },
    "name": {
      "type": "string",
      "description": "Name of the pet",
      "minLength": 1
    },
    "category": {
      "type": "object",
      "properties": {
        "id": {
          "type": "integer",
          "format": "int64"
        },
        "name": {
          "type": "string"
        }
      }
    },
    "photoUrls": {
      "type": "array",
      "items": {
        "type": "string"
      },
      "minItems": 1,
      "description": "List of photo URLs for the pet"
    },
    "tags": {
      "type": "array",
      "items": {
        "type": "object",
        "properties": {
          "id": {
            "type": "integer",
            "format": "int64"
          },
          "name": {
            "type": "string"
          }
        }
      }
    },
    "status": {
      "type": "string",
      "enum": ["available", "pending", "sold"],
      "description": "Pet status in the store"
    }
  }
}
